{
  "$schema": "https://json-schema.org/draft/2020-12/schema",
  "$id": "urn:fdp:eval:scenario:v1",
  "title": "Evaluation scenario",
  "description": "One replay the harness scores (docs/evaluation.md, \"Scenarios and profiles\"). It states what to replay, what to inject, which ground truth applies and what passing means. It carries no failure timestamp and no fault id except as a reference: windows, accepted causes and excluded windows are resolved at load time from @fdp/ground-truth.",
  "type": "object",
  "$defs": {
    "iso_ts": {
      "title": "Instant",
      "description": "UTC instant with millisecond precision and a literal Z, the contracts' iso_ts.",
      "type": "string",
      "pattern": "^\\d{4}-\\d{2}-\\d{2}T\\d{2}:\\d{2}:\\d{2}\\.\\d{3}Z$"
    },
    "identifier": {
      "title": "Identifier",
      "description": "The manual's identifier grammar.",
      "type": "string",
      "pattern": "^[a-z][a-z0-9_]{1,39}$"
    },
    "profile": {
      "title": "Profile",
      "description": "smoke is what CI replays, core is the test split (the core-10), dev is every scenario outside the core-10 and the held-out set (not a tuning set: the threshold sweep reads the --tuning list only), full is the E6 profile (the core-10 and eight dev scenarios, the whole recording included), heldout is the held-out set, which only its one final run replays (tools/eval/records/heldout-seal.md).",
      "type": "string",
      "enum": ["smoke", "core", "dev", "full", "heldout"]
    },
    "range_override": {
      "title": "Range override",
      "description": "A shorter replay range for one profile. An omitted bound keeps the one of replay.",
      "type": "object",
      "properties": {
        "from": { "$ref": "#/$defs/iso_ts" },
        "to": { "$ref": "#/$defs/iso_ts" }
      },
      "minProperties": 1,
      "additionalProperties": false
    },
    "injection": {
      "title": "Scheduled injection",
      "description": "One injection instance, referring to packages/ground-truth/data/injections.json by id. The fault it stands for and how long it runs come from that definition, never from here.",
      "type": "object",
      "properties": {
        "injection_id": { "$ref": "#/$defs/identifier" },
        "at": { "$ref": "#/$defs/iso_ts" },
        "params": {
          "description": "Instance parameters, checked against the definition's bounds at load time.",
          "type": "object",
          "additionalProperties": { "type": "number" }
        }
      },
      "required": ["injection_id", "at"],
      "additionalProperties": false
    }
  },
  "properties": {
    "schema": { "type": "string", "const": "urn:fdp:eval:scenario:v1" },
    "id": {
      "description": "The scenario id, equal to the file stem.",
      "type": "string",
      "pattern": "^[a-z][a-z0-9_]{2,63}$"
    },
    "title": {
      "description": "What the scenario replays, for a reader and for the report.",
      "type": "string",
      "minLength": 1
    },
    "group": {
      "description": "What kind of case this is. diagnostic scenarios are reported rather than gated.",
      "type": "string",
      "enum": ["recording_positive", "injected", "negative", "abstain", "diagnostic"]
    },
    "profiles": {
      "description": "The profiles that include this scenario. core holds exactly the test split, dev exactly the dev split and heldout exactly the heldout split, which the loader checks against split.",
      "type": "array",
      "items": { "$ref": "#/$defs/profile" },
      "minItems": 1,
      "uniqueItems": true
    },
    "split": {
      "description": "test is the core-10 the gate is measured on; dev is every other scenario outside the held-out set, not a tuning set (the threshold sweep reads the --tuning list of tools/eval/src/tuning.ts only); heldout is the held-out set, sealed before it was ever run and replayed once (tools/eval/records/heldout-seal.md).",
      "type": "string",
      "enum": ["dev", "test", "heldout"]
    },
    "positive": {
      "description": "True when the scenario expects at least one ticket or review, which is what the 5/6-positives half of the gate counts.",
      "type": "boolean"
    },
    "source": {
      "description": "Where the rows come from: a named slice of data/fixtures/metropt3-slices.json or the whole MetroPT-3 CSV.",
      "oneOf": [
        {
          "title": "Slice source",
          "type": "object",
          "properties": {
            "kind": { "const": "slice" },
            "name": {
              "description": "A slice name of data/fixtures/metropt3-slices.json.",
              "type": "string",
              "pattern": "^[a-z][a-z0-9-]{2,63}$"
            }
          },
          "required": ["kind", "name"],
          "additionalProperties": false
        },
        {
          "title": "CSV source",
          "type": "object",
          "properties": { "kind": { "const": "csv" } },
          "required": ["kind"],
          "additionalProperties": false
        }
      ]
    },
    "replay": {
      "description": "The half-open range [from, to) of the dataset clock this scenario replays, with optional per-profile overrides.",
      "type": "object",
      "properties": {
        "from": { "$ref": "#/$defs/iso_ts" },
        "to": { "$ref": "#/$defs/iso_ts" },
        "overrides": {
          "type": "object",
          "properties": {
            "smoke": { "$ref": "#/$defs/range_override" },
            "core": { "$ref": "#/$defs/range_override" },
            "dev": { "$ref": "#/$defs/range_override" },
            "full": { "$ref": "#/$defs/range_override" }
          },
          "minProperties": 1,
          "additionalProperties": false
        }
      },
      "required": ["from", "to"],
      "additionalProperties": false
    },
    "injections": {
      "description": "The injections the replay applies, in schedule order.",
      "type": "array",
      "items": { "$ref": "#/$defs/injection" }
    },
    "ground_truth": {
      "description": "Which ground truth applies. failure names a row of the failure table; recording takes every headline failure of the replayed range; injection takes the windows from the scheduled injections; negative, abstain and diagnostic have no positive window.",
      "oneOf": [
        {
          "title": "Recorded failure",
          "type": "object",
          "properties": {
            "kind": { "const": "failure" },
            "failure_id": {
              "description": "A failure id of packages/ground-truth/data/metropt3-failures.json.",
              "type": "string",
              "pattern": "^F[0-9]{1,2}[a-z]?$"
            }
          },
          "required": ["kind", "failure_id"],
          "additionalProperties": false
        },
        {
          "title": "Whole recording",
          "description": "Every headline failure the replayed range covers, which is what the MetroPT-3 check of metropt3_full scores.",
          "type": "object",
          "properties": { "kind": { "const": "recording" } },
          "required": ["kind"],
          "additionalProperties": false
        },
        {
          "title": "Injected fault",
          "type": "object",
          "properties": { "kind": { "const": "injection" } },
          "required": ["kind"],
          "additionalProperties": false
        },
        {
          "title": "Negative",
          "type": "object",
          "properties": { "kind": { "const": "negative" } },
          "required": ["kind"],
          "additionalProperties": false
        },
        {
          "title": "Abstention",
          "type": "object",
          "properties": {
            "kind": { "const": "abstain" },
            "reason": {
              "description": "Why nothing should be ticketed, in the words of the exclusion reasons or of the benign cause.",
              "type": "string",
              "minLength": 1
            }
          },
          "required": ["kind", "reason"],
          "additionalProperties": false
        },
        {
          "title": "Diagnostic",
          "type": "object",
          "properties": {
            "kind": { "const": "diagnostic" },
            "note": {
              "description": "What the run is expected to show, since the scenario is reported rather than gated.",
              "type": "string",
              "minLength": 1
            }
          },
          "required": ["kind", "note"],
          "additionalProperties": false
        }
      ]
    },
    "expect": {
      "description": "What passing means. The latency budget is counted from max(data_onset, replay.from + warmup_min).",
      "type": "object",
      "properties": {
        "tickets": {
          "description": "Whether a ticket is required or forbidden.",
          "type": "string",
          "enum": ["at_least_one", "none"]
        },
        "fault": {
          "description": "Which cause counts as right: the window's accepted_fault_ids, the injection definition's fault_id, any benign cause or none at all, or anything.",
          "type": "string",
          "enum": ["accepted", "injected", "benign_or_none", "any"]
        },
        "within_min": {
          "description": "Minutes the first accepted ticket may take. Positives only.",
          "type": "integer",
          "minimum": 1
        },
        "max_false_tickets": {
          "description": "How many non-accepted, non-benign tickets the replayed range may produce.",
          "type": "integer",
          "minimum": 0,
          "default": 0
        },
        "pass_level": {
          "description": "detection asks only that something was raised in the window; diagnosis asks that the named cause is accepted.",
          "type": "string",
          "enum": ["detection", "diagnosis"]
        }
      },
      "required": ["tickets", "fault", "pass_level"],
      "additionalProperties": false
    },
    "design_target": {
      "title": "Design target",
      "description": "A design aid, not ground truth: the causes a diagnosis of the scenario's unlabelled episodes (the failure table's excluded windows with reason unlabelled_positive, resolved at load time) is read against. The tuning readout and the threshold sweep report it; no gate, exit eval, pass rule or threshold selection reads it, and the episodes stay excluded windows. Only a diagnostic scenario of the dev split may carry one, and its replayed range must hold an unlabelled episode.",
      "type": "object",
      "properties": {
        "accepted": {
          "description": "The causes a diagnosis is read against, primary first; each must be a cause the ground-truth data names.",
          "type": "array",
          "items": { "$ref": "#/$defs/identifier" },
          "minItems": 1,
          "uniqueItems": true
        },
        "provenance": {
          "description": "Where the target comes from and how far it is verified, in words.",
          "type": "string",
          "minLength": 1
        }
      },
      "required": ["accepted", "provenance"],
      "additionalProperties": false
    },
    "native_alarm_codes": {
      "description": "The controller codes lead time is measured against. Omitted means every evaluable warning and shutdown code except W116.",
      "type": "array",
      "items": { "type": "string", "pattern": "^[WXSM][0-9]{3}$" },
      "minItems": 1,
      "uniqueItems": true
    },
    "warmup_min": {
      "description": "Samples before this many minutes of replay are fed to the pipeline but not scored.",
      "type": "integer",
      "minimum": 0,
      "default": 60
    },
    "seed": {
      "description": "The seed every random source of the replay is derived from, so two runs of a profile agree.",
      "type": "integer",
      "minimum": 0
    },
    "notes": {
      "description": "Why this window, what the data shows, and where that is written down.",
      "type": "string",
      "minLength": 1
    }
  },
  "required": [
    "schema",
    "id",
    "title",
    "group",
    "profiles",
    "split",
    "positive",
    "source",
    "replay",
    "ground_truth",
    "expect",
    "seed",
    "notes"
  ],
  "additionalProperties": false
}
