{
  "schema": "urn:fdp:eval:scenario:v1",
  "id": "inject_intake_valve_sticking",
  "title": "Injected sticking intake valve on a normal day",
  "group": "injected",
  "profiles": ["dev", "full"],
  "split": "dev",
  "positive": true,
  "source": {
    "kind": "slice",
    "name": "baseline-feb03"
  },
  "replay": {
    "from": "2020-02-03T00:00:00.000Z",
    "to": "2020-02-04T00:00:00.000Z"
  },
  "injections": [
    {
      "injection_id": "intake_valve_sticking",
      "at": "2020-02-03T02:00:00.000Z",
      "params": {
        "magnitude": 1
      }
    }
  ],
  "ground_truth": {
    "kind": "injection"
  },
  "expect": {
    "tickets": "at_least_one",
    "fault": "injected",
    "within_min": 120,
    "max_false_tickets": 0,
    "pass_level": "diagnosis"
  },
  "warmup_min": 60,
  "seed": 21,
  "notes": "An intake-side fault, so the signature is the load cycle rather than the line pressure. Outside the core-10, which makes it part of the dev split the threshold sweep may look at."
}
