{
  "schema": "urn:fdp:eval:scenario:v1",
  "id": "frozen_logger_jun22",
  "title": "Frozen logger, 22 June 2020",
  "group": "negative",
  "profiles": ["dev", "full"],
  "split": "dev",
  "positive": false,
  "source": {
    "kind": "slice",
    "name": "frozen-jun22"
  },
  "replay": {
    "from": "2020-06-22T12:00:00.000Z",
    "to": "2020-06-23T00:00:00.000Z"
  },
  "ground_truth": {
    "kind": "negative"
  },
  "expect": {
    "tickets": "none",
    "fault": "benign_or_none",
    "max_false_tickets": 0,
    "pass_level": "detection"
  },
  "warmup_min": 60,
  "seed": 39,
  "notes": "The longest of the nine frozen blocks starts at 15:06:21 and the failure table excludes it, so the scenario is really about the three hours of live data before it: a detector that reads a repeated row as a stuck signal must not open a ticket when the recording, not the machine, is what stopped."
}
