{
  "schema": "urn:fdp:eval:scenario:v1",
  "id": "f4_air_leak_jul15",
  "title": "Air leak, signature B, 15 July 2020",
  "group": "recording_positive",
  "profiles": ["core", "full"],
  "split": "test",
  "positive": true,
  "source": {
    "kind": "slice",
    "name": "f4-jul15"
  },
  "replay": {
    "from": "2020-07-15T12:00:00.000Z",
    "to": "2020-07-16T02:00:00.000Z"
  },
  "ground_truth": {
    "kind": "failure",
    "failure_id": "F4"
  },
  "expect": {
    "tickets": "at_least_one",
    "fault": "accepted",
    "within_min": 60,
    "max_false_tickets": 0,
    "pass_level": "diagnosis"
  },
  "native_alarm_codes": ["W101", "W102", "W103"],
  "warmup_min": 60,
  "seed": 15,
  "notes": "The acute phase, and the one window where the controller's own alarm gives a figure to beat: LPS first closes at 17:20:11 while the data turns at 14:25:23. The repair that follows, 19:00 to 16 July 01:00, is an excluded window and nothing raised in it is scored."
}
