{
  "schema": "urn:fdp:eval:scenario:v1",
  "id": "inject_oil_temperature_sensor_fault",
  "title": "Injected oil temperature sensor fault, an instrumentation case",
  "group": "abstain",
  "profiles": ["smoke", "core", "full"],
  "split": "test",
  "positive": false,
  "source": {
    "kind": "slice",
    "name": "baseline-feb03"
  },
  "replay": {
    "from": "2020-02-03T00:00:00.000Z",
    "to": "2020-02-04T00:00:00.000Z",
    "overrides": {
      "smoke": {
        "to": "2020-02-03T10:00:00.000Z"
      }
    }
  },
  "injections": [
    {
      "injection_id": "oil_temperature_sensor_fault",
      "at": "2020-02-03T02:00:00.000Z",
      "params": {
        "magnitude": 1
      }
    }
  ],
  "ground_truth": {
    "kind": "abstain",
    "reason": "instrumentation: the transmitter reports a value the machine is not at, while every other cooled quantity stays in its band"
  },
  "expect": {
    "tickets": "none",
    "fault": "benign_or_none",
    "max_false_tickets": 0,
    "pass_level": "diagnosis"
  },
  "warmup_min": 60,
  "seed": 31,
  "notes": "The second \"benign cause with alarming symptoms\", and the one the smoke profile runs. A correct answer names the sensor fault or opens nothing; a ticket for a cooling defect is a false positive. The definition has no ramp and runs for two hours."
}
