{
  "schema": "urn:fdp:eval:scenario:v1",
  "id": "inject_air_leak_downstream",
  "title": "Injected downstream air leak on a normal day",
  "group": "injected",
  "profiles": ["core", "full"],
  "split": "test",
  "positive": true,
  "source": {
    "kind": "slice",
    "name": "baseline-feb03"
  },
  "replay": {
    "from": "2020-02-03T00:00:00.000Z",
    "to": "2020-02-04T00:00:00.000Z"
  },
  "injections": [
    {
      "injection_id": "air_leak_downstream",
      "at": "2020-02-03T02:00:00.000Z",
      "params": {
        "magnitude": 1
      }
    }
  ],
  "ground_truth": {
    "kind": "injection"
  },
  "expect": {
    "tickets": "at_least_one",
    "fault": "injected",
    "within_min": 180,
    "max_false_tickets": 0,
    "pass_level": "diagnosis"
  },
  "warmup_min": 60,
  "seed": 19,
  "notes": "The injected counterpart of the recorded signature B: the same cause the July failure has, on a day with no failure of its own, so a miss here is the detector's and not the recording's. The definition ramps in over ten minutes and runs for four hours."
}
