{
  "schema": "urn:fdp:eval:scenario:v1",
  "id": "heldout_normal_aug01",
  "title": "Held-out: normal operation, 1 August 2020",
  "group": "negative",
  "profiles": ["heldout"],
  "split": "heldout",
  "positive": false,
  "source": {
    "kind": "slice",
    "name": "heldout-aug01"
  },
  "replay": {
    "from": "2020-08-01T00:00:00.000Z",
    "to": "2020-08-02T00:00:00.000Z"
  },
  "ground_truth": {
    "kind": "negative"
  },
  "expect": {
    "tickets": "none",
    "fault": "benign_or_none",
    "max_false_tickets": 0,
    "pass_level": "detection"
  },
  "warmup_min": 60,
  "seed": 59,
  "notes": "H6 held-out negative (docs/plan/heldout-seal.md): a normal day drawn by the rule committed before the draw, from the days no scenario, slice, tuning case or document had used, 48 h or more from every labelled failure and unlabelled episode, with no known anomaly or gap. The expectation is that of the existing normal days (baseline_feb03_normal, summer_normal_jul05). Split heldout, profile heldout only: every other profile, --scenario and the tuning list refuse it, and only the set's one final run replays it, after the Von thresholds are fixed under the pre-registration. H6 was decided after the E3 and E4 results had been seen, so every earlier figure stays in-sample."
}
